id,obj_1,obj_2,obj_3,odd,reason_for_similarity,obj_4
3246,Marc Chagall,Salvador Dali,Wassily Kandinsky,Salvador Dali,The others are artists of the Russian avant-garde,Kazimir Malevich
3247,Theo van Doesburg,Henri Matisse,Piet Mondrian,Henri Matisse,The others are artists of the De Stijl movement,Bart van der Leck
3248,Sandro Botticelli,Michelangelo,Caravaggio,Caravaggio,The others are artists of the Early Renaissance,Leonardo da Vinci
3249,Tintoretto,Giorgione,Titian,Raphael,The others are Venetian Renaissance painters,Raphael
3250,Jean-Auguste-Dominique Ingres,Honoré Daumier,Jean-François Millet,Jean-Auguste-Dominique Ingres,The others are artists of the Realism movement,Gustave Courbet
3251,Sandro Botticelli,Domenico Ghirlandaio,Pietro Perugino,Caravaggio,The others are artists of the Early Italian Renaissance,Caravaggio
3252,Nicolas Poussin,Claude Lorrain,Simon Vouet,Pierre-Auguste Renoir,The others are French Baroque painters,Pierre-Auguste Renoir
3253,Jean-Auguste-Dominique Ingres,Jacques-Louis David,Eugène Delacroix,Paul Cézanne,The others are artists of the Neoclassicism movement,Paul Cézanne
3254,Pierre Puvis de Chavannes,Odilon Redon,Vincent van Gogh,Vincent van Gogh,The others are Symbolists,Gustave Moreau
3255,Wittgenstein,Voltaire,Rousseau,Wittgenstein,The others were philosophers of the Enlightenment,Diderot
3256,Epicurus,Marx,Epictetus,Marx,The others are ancient Greek philosophers associated with Hellenistic schools,Zeno
3257,James,Russell,Dewey,Russell,The others are pragmatists,Peirce
3258,Russell,Whitehead,Frege,Thoreau,The others are logicians,Thoreau
3259,Berkeley,Locke,Hume,Kierkegaard,The others are empiricists,Kierkegaard
3260,Popper,Kuhn,Feyerabend,Plato,The others are philosophers of science,Plato
3261,Kierkegaard,Mill,Nietzsche,Mill,The others are associated with nihilism,Schopenhauer
3262,Engels,Descartes,Hegel,Descartes,The others are dialectical materialists,Marx
3263,Locke,Kant,Heidegger,Heidegger,The others are philosophers of the Enlightenment,Hume
3264,Socrates,Aristotle,Plato,Kierkegaard,The others are philosophers of ancient Greece,Kierkegaard
3265,Foucault,Derrida,Socrates,Socrates,The others are postmodernists,Barthes
3266,Beauvoir,Kant,Camus,Kant,The others are French existentialists,Sartre
3267,Rule of thirds,Depth of field,Leading lines,Color wheel,The others are photography composition techniques,Color wheel
3268,Color grading,Retouching,Cropping,Sketching,The others are photo editing techniques,Sketching
3269,Sergei Prokofiev,Franz Schubert,Dmitri Shostakovich,Franz Schubert,The others are Russian composers.,Sergei Rachmaninoff
3270,Franz Liszt,Ludwig van Beethoven,Frederic Chopin,Ludwig van Beethoven,The others were known for their virtuosic piano playing.,Sergei Rachmaninoff
3271,Robert Frost,E. E. Cummings,William Wordsworth,William Wordsworth,The others are 20th century poets.,T. S. Eliot
3272,Percy Bysshe Shelley,Robert Frost,Lord Byron,Robert Frost,The others are Romantic poets.,John Keats
3273,Emily Dickinson,Jack Kerouac,William S. Burroughs,Emily Dickinson,The others are Beat Generation poets.,Allen Ginsberg
3274,William Blake,Samuel Taylor Coleridge,Robert Southey,William Blake,The others are Lake Poets.,William Wordsworth
3275,Arthur Rimbaud,Emily Dickinson,Charles Baudelaire,Emily Dickinson,The others are French poets.,Paul Verlaine
3276,Robert Frost,Ben Jonson,William Shakespeare,Robert Frost,The others are poets of the English Renaissance.,John Donne
3277,H. D.,T. S. Eliot,Ezra Pound,Robert Frost,The others are Imagist poets.,Robert Frost
3278,Langston Hughes,William Wordsworth,Claude McKay,William Wordsworth,The others are Harlem Renaissance poets.,Zora Neale Hurston
3279,Geoffrey Chaucer,Robert Frost,Thomas Hoccleve,Robert Frost,The others are Middle English poets.,John Gower
3280,John Dryden,Alexander Pope,William Shakespeare,William Shakespeare,The others are Augustan poets.,Samuel Johnson
3281,William Blake,Emily Dickinson,Samuel Taylor Coleridge,Emily Dickinson,The others are poets of the English Romantic movement.,William Wordsworth
3282,Ben Jonson,Robert Frost,William Shakespeare,Robert Frost,The others are Elizabethan poets.,Christopher Marlowe
3283,Walter Scott,Robert Burns,Emily Dickinson,Emily Dickinson,The others are Scottish poets.,James Hogg
3284,Robert Frost,William Shakespeare,John Milton,Robert Frost,The others are 17th century English poets.,John Dryden
3285,Anne Sexton,Robert Lowell,Sylvia Plath,Emily Dickinson,The others are Confessional poets.,Emily Dickinson
3286,Percy Bysshe Shelley,Lord Byron,John Keats,William Shakespeare,The others are poets of the Romantic movement.,William Shakespeare
3287,Franklin D. Roosevelt,Bill Clinton,Jimmy Carter,Boris Johnson,The others are former U.S. Presidents,Boris Johnson
3288,Bill Clinton,Richard Nixon,Barack Obama,Barack Obama,The others have faced impeachment,Andrew Johnson
3289,Jacob Zuma,Olusegun Obasanjo,Muhammadu Buhari,Jacob Zuma,The others are Nigerian Presidents,Goodluck Jonathan
3290,Endel Tulving,Carl Jung,Elizabeth Loftus,Carl Jung,The others are memory researchers,Daniel Schacter
3291,Carl Jung,Lewis Terman,Charles Spearman,Carl Jung,The others are intelligence researchers,Francis Galton
3292,Biscuits,Ice Cream,Bread,Ice Cream,The others are baked,Cake
3293,Biscotti,Madeleine,Macaron,Gelato,The others are baked Italian/French desserts,Gelato
3294,Shortbread,Crumpet,Scone,Pancake,The others are baked British treats,Pancake
3295,Whiskey Sour,Old Fashioned,Mint Julep,Bloody Mary,The others are whiskey cocktails,Bloody Mary
3296,Martini Glass,Old Fashioned Glass,Beer Mug,Beer Mug,The others are cocktail glasses,Highball Glass
3297,Ice Scoop,Cutting Board,Strainer,Cutting Board,The others are used directly in drink preparation,Muddler
3298,Mojito,Tequila Sunrise,Pina Colada,Tequila Sunrise,The others are rum cocktails,Daiquiri
3299,Lime,Sugar,Tonic Water,Tonic Water,The others are ingredients in a daiquiri,Bitters
3300,Aperol Spritz,Margarita,Americano,Margarita,The others are apéritif cocktails,Negroni
3301,Mezcal,Rum,Sotol,Rum,The others are Mexican spirits,Tequila
3302,Bloody Mary,Mojito,Black Russian,Mojito,The others are vodka cocktails,Screwdriver
3303,French 75,Gin Fizz,Old Fashioned,Old Fashioned,The others are gin cocktails,Tom Collins
3304,Vermouth,Triple Sec,Cointreau,Vermouth,The others are orange liqueurs,Grand Marnier
3305,Pimm's Cup,Dark 'n' Stormy,Moscow Mule,Margarita,The others are served in copper mugs,Margarita
3306,Rye,Bourbon,Brandy,Brandy,The others are whiskies,Scotch
3307,Pina Colada,Cuba Libre,Mojito,Pina Colada,The others are served with lime,Daiquiri
3308,Baileys,Campari,Fernet-Branca,Baileys,The others are bitter liqueurs,Jägermeister
3309,Lemon Twist,Lime Wedge,Olive,Lime Wedge,The others are garnishes for a martini,Cherry
3310,Ouzo,Sambuca,Tequila,Tequila,The others are anise-flavored,Arak
3311,Heineken,Corona,Pilsner Urquell,Corona,The others are European beers,Guinness
3312,Stone Brewing,Dogfish Head,Bell's Brewery,Anheuser-Busch,The others are microbreweries,Anheuser-Busch
3313,Magic Rock,Beavertown,Stella Artois,Stella Artois,The others are UK craft beers,BrewDog
3314,Pliny the Elder,Heady Topper,Budweiser,Budweiser,The others are IPA beers,Zombie Dust
3315,Duvel,Miller Lite,Orval,Miller Lite,The others are Trappist beers,Westmalle
3316,Budweiser,Pelforth,Kronenbourg 1664,Budweiser,The others are French beers,Fischer
3317,Bud Light,Zhiguli,Baltika,Bud Light,The others are Russian beers,Nevskoye
3318,Bomonti,Tuborg,Efes,Heineken,The others are Turkish beers,Heineken
3320,Cabernet Sauvignon,Château Latour,Château Lafite Rothschild,Cabernet Sauvignon,The others are French wineries,Château Margaux
3321,Keg,Barrique,Demijohn,Keg,The others are wine storage vessels,Amphora
3322,Château Latour,Château Lafite Rothschild,Château Margaux,Dom Pérignon,The others are Bordeaux wineries,Dom Pérignon
3323,Napa Valley,Hunter Valley,Yarra Valley,Napa Valley,The others are Australian wine regions,Barossa Valley
3324,Malolactic fermentation,Saignée,Carbonic maceration,Decanting,The others are winemaking techniques,Decanting
3325,Maturation,Bottling,Distillation,Distillation,The others are stages of winemaking,Vinification
3326,Chardonnay,Merlot,Cabernet Sauvignon,Chardonnay,The others are Bordeaux grape varietals,Cabernet Franc
3328,Chablis,Barolo,Sancerre,Barolo,The others are French wines,Pouilly-Fumé
3329,Pot Still,Column Still,Fermentation Vat,Fermentation Vat,The others are types of distillers,Alembic Still
3330,Single Malt,Single Grain,Blended Malt,Rum,The others are types of Scotch whisky,Rum
3331,Mash,Hearts,Angel's Share,Mash,The others are distillation cuts,Foreshots
3332,Yeast,Barrel,Water,Barrel,The others are ingredients in distillation,Grain
3333,Aging,Distillation,Bottling,Fermentation,The others are post-distillation processes,Fermentation
3334,Cask Strength,Single Barrel,Small Batch,Vodka,The others are whiskey classifications,Vodka
3335,Cognac,Armagnac,Scotch,Scotch,The others are types of brandy,Brandy
3336,Rum,Absinthe,Gin,Absinthe,The others are distilled from grain,Vodka
3337,Glass,Stainless Steel,Copper,Wood,The others are materials used to make distillers,Wood
3338,Malt,Grain,Pot Still,Column Still,The others are used in the mashing process,Column Still
3339,Jameson,Chivas Regal,Johnnie Walker,Jameson,The others are Scotch whisky brands,Ballantine's
3340,Grey Goose,Absolut,Bacardi,Bacardi,The others are vodka brands,Smirnoff
3341,Bombay Sapphire,Beefeater,Jack Daniels,Jack Daniels,The others are gin brands,Tanqueray
3342,Lagavulin,Macallan,Ardbeg,Macallan,The others are Islay Scotch whiskies,Laphroaig
3343,Laphroaig,Glenmorangie,Macallan,Laphroaig,The others are Highland Scotch whiskies,Dalmore
3344,Glen Deveron,Auchentoshan,Glenkinchie,Talisker,The others are Lowland Scotch whiskies,Talisker
3345,Glenfiddich,Balvenie,Glenlivet,Talisker,The others are Speyside Scotch whiskies,Talisker
3346,Kareem Abdul-Jabbar,Shaquille O'Neal,Scottie Pippen,Scottie Pippen,The others are Los Angeles Lakers' MVPs.,Magic Johnson
3347,Scottie Pippen,Michael Jordan,Dennis Rodman,Karl Malone,The others played for the Chicago Bulls.,Karl Malone
3348,Kevin Garnett,Bill Russell,Paul Pierce,Bill Russell,The others are NBA Finals MVPs.,Larry Bird
3349,Anthony Davis,Dwyane Wade,Chris Bosh,Anthony Davis,The others won an NBA championship with the Miami Heat.,LeBron James
3350,Jason Terry,Steve Nash,J.J. Barea,Steve Nash,The others won an NBA championship with the Dallas Mavericks.,Dirk Nowitzki
3351,Kareem Abdul-Jabbar,Magic Johnson,James Worthy,Larry Bird,The others won an NBA championship with the Los Angeles Lakers.,Larry Bird
3352,Dennis Rodman,Michael Jordan,Shaquille O'Neal,Shaquille O'Neal,The others are part of the 1996 Chicago Bulls.,Scottie Pippen
3353,Tim Duncan,Tony Parker,Kawhi Leonard,Kawhi Leonard,The others are part of the 2007 San Antonio Spurs.,Manu Ginobili
3354,Shaquille O'Neal,Tracy McGrady,Kobe Bryant,Tracy McGrady,The others are part of the 2002 Los Angeles Lakers.,Derek Fisher
3355,Tony Parker,Manu Ginobili,David Robinson,David Robinson,The others are part of the 2005 San Antonio Spurs.,Tim Duncan
3356,Magic Johnson,Larry Bird,Kevin McHale,Magic Johnson,The others are part of the 1986 Boston Celtics.,Robert Parish
3357,Charles Barkley,Michael Jordan,Scottie Pippen,Charles Barkley,The others are part of the 1998 Chicago Bulls.,Dennis Rodman
3358,LeBron James,Chris Bosh,Dwyane Wade,Kevin Durant,The others are part of the 2012 Miami Heat.,Kevin Durant
3359,Magic Johnson,Larry Bird,James Worthy,Larry Bird,The others are part of the 1985 Los Angeles Lakers.,Kareem Abdul-Jabbar
3360,Manu Ginobili,Shaquille O'Neal,Tim Duncan,Shaquille O'Neal,The others are part of the 2003 San Antonio Spurs.,Tony Parker
3361,Karl Malone,Scottie Pippen,Dennis Rodman,Karl Malone,The others are part of the 1997 Chicago Bulls.,Michael Jordan
3362,Dirk Nowitzki,LeBron James,Dwyane Wade,Dirk Nowitzki,The others are part of the 2013 Miami Heat.,Chris Bosh
3363,Larry Bird,Magic Johnson,James Worthy,Larry Bird,The others are part of the 1987 Los Angeles Lakers.,Kareem Abdul-Jabbar
3364,Shaquille O'Neal,Tracy McGrady,Derek Fisher,Tracy McGrady,The others are part of the 2000 Los Angeles Lakers.,Kobe Bryant
3365,Robert Parish,Magic Johnson,Kevin McHale,Magic Johnson,The others are part of the 1984 Boston Celtics.,Larry Bird
3366,Willie Mays,Hank Aaron,Mike Trout,Mike Trout,The others played before 1980,Roberto Clemente
3367,Yogi Berra,Johnny Bench,Cal Ripken Jr.,Cal Ripken Jr.,The others are catchers,Mike Piazza
3368,Ty Cobb,Lou Brock,Rickey Henderson,Babe Ruth,The others are base stealers,Babe Ruth
3369,Hank Aaron,Ty Cobb,Cy Young,Cy Young,The others are hitters,Pete Rose
3370,Barry Bonds,Mark McGwire,Sammy Sosa,Derek Jeter,The others have hit 60+ home runs in a season,Derek Jeter
3371,Sandy Koufax,Rickey Henderson,Nolan Ryan,Rickey Henderson,The others are strikeout leaders,Randy Johnson
3372,Greg Maddux,Miguel Tejada,Cal Ripken Jr.,Greg Maddux,The others are consecutive game streak holders,Lou Gehrig
3373,Pete Rose,Honus Wagner,Joe DiMaggio,Honus Wagner,The others have hit streaks of 40+ games,Willie Keeler
3374,Jackie Robinson,Ernie Banks,Ted Williams,Ted Williams,The others were pioneers in breaking the color barrier,Larry Doby
3375,Tony Gwynn,Roberto Clemente,Rod Carew,Babe Ruth,The others are known for their high batting averages,Babe Ruth
3376,Mike Piazza,Cal Ripken Jr.,Ozzie Smith,Mike Piazza,The others are shortstops,Derek Jeter
3377,Babe Ruth,Ty Cobb,Pete Rose,Babe Ruth,The others have 4000+ professional hits,Ichiro Suzuki
3378,Hank Aaron,Babe Ruth,Barry Bonds,Rickey Henderson,The others are home run leaders,Rickey Henderson
3379,Sandy Koufax,Mickey Mantle,Willie Mays,Sandy Koufax,The others are outfielders,Hank Aaron
3380,Brooks Robinson,Mike Schmidt,Lou Gehrig,Lou Gehrig,The others are third basemen,George Brett
3381,Roger Clemens,Randy Johnson,Babe Ruth,Babe Ruth,The others have 300+ career wins,Nolan Ryan
3382,Ted Williams,Willie Mays,Mickey Mantle,Willie Mays,The others have a career on-base percentage over .400,Babe Ruth
3383,Cal Ripken Jr.,Joe DiMaggio,Miguel Tejada,Joe DiMaggio,The others have played in 2000+ consecutive games,Lou Gehrig
3384,Floyd Mayweather,Manny Pacquiao,Oscar De La Hoya,Sugar Ray Robinson,The others are boxers of the modern era,Sugar Ray Robinson
3385,Rocky Marciano,Lennox Lewis,Evander Holyfield,Rocky Marciano,The others are heavyweight champions of the 90s,Mike Tyson
3386,Marvin Hagler,Roberto Duran,Sugar Ray Leonard,George Foreman,The others are middleweight champions,George Foreman
3387,Fred Astaire,Mikhail Baryshnikov,Rudolf Nureyev,Fred Astaire,The others are ballet dancers.,Vaslav Nijinsky
3388,Fred Astaire,Ginger Rogers,Margot Fonteyn,Margot Fonteyn,The others are tap dancers.,Gene Kelly
3389,Mary Wigman,Martha Graham,Isadora Duncan,Bob Fosse,The others are modern dancers.,Bob Fosse
3390,Anna Pavlova,Michael Flatley,Jean Butler,Anna Pavlova,The others are Irish dancers.,Colin Dunne
3391,Marius Petipa,George Balanchine,Jerome Robbins,Jerome Robbins,The others are ballet choreographers.,Lev Ivanov
3392,Bryan Watson,Merce Cunningham,Yulia Zagoruychenko,Merce Cunningham,The others are ballroom dancers.,Pierre Dulaine
3393,Mikhail Baryshnikov,Gower Champion,Jerome Robbins,Mikhail Baryshnikov,The others are Broadway choreographers.,Bob Fosse
3394,Vaslav Nijinsky,Fred Astaire,Rudolf Nureyev,Fred Astaire,The others are Russian dancers.,Mikhail Baryshnikov
3395,Twyla Tharp,Gene Kelly,Martha Graham,Gene Kelly,The others are modern choreographers.,Merce Cunningham
3396,Galina Ulanova,Janet Jackson,Michael Jackson,Galina Ulanova,The others are pop dancers.,Paula Abdul
3397,Pierre Dulaine,Isadora Duncan,Mary Wigman,Pierre Dulaine,The others are pioneers of modern dance.,Martha Graham
3398,Fred Astaire,Bill Robinson,Vaslav Nijinsky,Vaslav Nijinsky,The others are film dancers.,Gene Kelly
3399,George Balanchine,Pierre Dulaine,Bryan Watson,George Balanchine,The others are Latin dancers.,Yulia Zagoruychenko
3400,Lombardi Trophy,Green Jacket,Wanamaker Trophy,Lombardi Trophy,The others are golf tournament prizes,Claret Jug
3401,Flop Shot,Free Kick,Stinger,Free Kick,The others are golf shots,Punch Shot
3402,Babe Didrikson Zaharias,Tommy Armour,Horton Smith,Babe Didrikson Zaharias,The others are male professional golfers,Johnny Farrell
3403,Brett Hull,Mark Howe,Bobby Hull,Gordie Howe,The others are father-son duos,Gordie Howe
3404,Wayne Gretzky,Ray Bourque,Chris Pronger,Wayne Gretzky,The others are defensemen,Scott Stevens
3405,Denis Potvin,Mario Lemieux,Paul Coffey,Mario Lemieux,The others won the Norris Trophy,Bobby Orr
3406,Brett Hull,Dominik Hasek,Patrick Roy,Brett Hull,The others won the Vezina Trophy,Martin Brodeur
3407,Evgeni Malkin,Jaromir Jagr,Sidney Crosby,Jaromir Jagr,The others are Penguins' captains,Mario Lemieux
3408,Jari Kurri,Paul Coffey,Wayne Gretzky,Paul Coffey,The others won the Hart Trophy,Mark Messier
3409,Evgeni Nabokov,Pavel Datsyuk,Alex Ovechkin,Evgeni Nabokov,The others are Russian forwards,Sergei Fedorov
3410,Bernie Parent,Bobby Clarke,Bill Barber,Mike Bossy,The others played for the Flyers,Mike Bossy
3411,Patrick Roy,Mats Sundin,Peter Forsberg,Mats Sundin,The others played for the Avalanche,Joe Sakic
3412,Miikka Kiprusoff,Jarome Iginla,Dion Phaneuf,Joe Thornton,The others played for the Flames,Joe Thornton
3413,Adam Foote,Teemu Selanne,Peter Forsberg,Teemu Selanne,The others won a Stanley Cup with the Avalanche,Joe Sakic
3414,Peter Tosh,David Bowie,Bob Marley,David Bowie,The others are reggae musicians,Bunny Wailer
3415,Eddie Vedder,Kurt Cobain,Chris Cornell,Axl Rose,The others are grunge musicians,Axl Rose
3416,The Beatles,The Cure,The Smiths,The Beatles,The others are 80s alternative bands,Depeche Mode
3417,Metallica,Megadeth,Slayer,Nirvana,The others are thrash metal bands,Nirvana
3418,The Doors,The Kinks,The Yardbirds,The Doors,The others are British Invasion bands,The Who
3419,Mick Jagger,Janis Joplin,Jimi Hendrix,Mick Jagger,The others died at age 27,Jim Morrison
3420,The Ramones,The Clash,The Sex Pistols,The Ramones,The others are British punk bands,The Damned
3421,Socrates,Hobbes,Aristotle,Hobbes,The others are philosophers of the Classical period,Plato
3422,Locke,Hegel,Schopenhauer,Locke,The others are philosophers of the German Idealism,Kant
3423,Confucius,Xunzi,Mencius,Rousseau,The others are Confucian philosophers,Rousseau
3424,Nietzsche,Kierkegaard,Sartre,Locke,The others are Existentialists,Locke
3425,Moore,Nietzsche,Wittgenstein,Nietzsche,The others are philosophers of the Analytic tradition,Russell
3426,Plato,Hobbes,Locke,Plato,The others are philosophers of the Social Contract,Rousseau
3427,Augustine,Anselm,Spinoza,Spinoza,The others are philosophers of the Scholasticism,Aquinas
3428,Marx,Sartre,Engels,Sartre,The others are philosophers of the Dialectical materialism,Hegel
3429,Jelly Roll Morton,Sergei Prokofiev,Fats Waller,Sergei Prokofiev,The others are ragtime pianists,Scott Joplin
3430,Stevie Wonder,Alicia Keys,Johannes Brahms,Johannes Brahms,The others are R&B pianists,Ray Charles
3431,Yundi Li,Yuja Wang,John Legend,John Legend,The others are Chinese pianists,Lang Lang
3432,Hiromi Uehara,Robert Glasper,Johann Sebastian Bach,Johann Sebastian Bach,The others are jazz fusion pianists,Chick Corea
3433,Liberace,Sergei Rachmaninoff,Billy Joel,Sergei Rachmaninoff,The others are pop pianists,Elton John
3434,Fats Domino,Ludwig van Beethoven,Jerry Lee Lewis,Ludwig van Beethoven,The others are rock and roll pianists,Little Richard
3435,Franz Liszt,Richard Wright,Tony Banks,Franz Liszt,The others are rock keyboardists,Ray Manzarek
3436,Regina Spektor,Johann Sebastian Bach,Fiona Apple,Johann Sebastian Bach,The others are alternative pop pianists,Tori Amos
3437,Wolfgang Amadeus Mozart,Booker T. Jones,Steve Winwood,Wolfgang Amadeus Mozart,The others are soul pianists,Billy Preston
3438,Allen Ginsberg,William Blake,Jack Kerouac,William Blake,The others are Beat Generation poets,Sylvia Plath
3439,Pablo Neruda,Hafez,Rumi,Pablo Neruda,The others are Persian poets,Omar Khayyam
3440,e.e. cummings,W.B. Yeats,Robert Frost,e.e. cummings,The others are winners of the Nobel Prize in Literature,T.S. Eliot
3441,Langston Hughes,Emily Dickinson,Zora Neale Hurston,Emily Dickinson,The others are part of the Harlem Renaissance,Toni Morrison
3442,Percy Bysshe Shelley,John Keats,Robert Burns,Robert Burns,The others are part of the second generation of Romantic poets,Lord Byron
3443,Walt Whitman,Emily Dickinson,Edgar Allan Poe,Charles Dickens,The others are poets of the 19th century,Charles Dickens
3444,Mark Twain,E.E. Cummings,Robert Frost,Mark Twain,The others are part of the Modernist movement,Carl Sandburg
3445,Geoffrey Chaucer,William Shakespeare,Ben Jonson,Geoffrey Chaucer,The others are poets of the Elizabethan era,John Donne
3446,Dante Alighieri,Giovanni Boccaccio,Victor Hugo,Victor Hugo,The others are poets of the Italian Renaissance,Petrarch
3447,William Wordsworth,Samuel Taylor Coleridge,William Blake,Thomas Hardy,The others are poets of the Romantic era,Thomas Hardy
3448,Walt Whitman,Edgar Allan Poe,Ralph Waldo Emerson,Edgar Allan Poe,The others are Transcendentalist poets,Henry David Thoreau
3450,Martin Luther King Jr.,Maya Angelou,Langston Hughes,Martin Luther King Jr.,The others are poets of the Civil Rights Movement,Toni Morrison
3451,William Shakespeare,Christopher Marlowe,Ben Jonson,Geoffrey Chaucer,The others are poets of the English Renaissance,Geoffrey Chaucer
3452,J.D. Salinger,Jack Kerouac,Allen Ginsberg,J.D. Salinger,The others are poets of the Beat Generation,William S. Burroughs
3453,Jimmy Carter,Barack Obama,Bill Clinton,Jimmy Carter,The others served two full terms as President,George W. Bush
3454,Angela Merkel,Margaret Thatcher,Hillary Clinton,Hillary Clinton,The others have served as a Prime Minister,Theresa May
3455,Benjamin Franklin,George Washington,Thomas Jefferson,Benjamin Franklin,The others have been Presidents of the United States,Franklin D. Roosevelt
3456,Pierre Trudeau,Stephen Harper,Justin Trudeau,Stephen Harper,The others are Liberal Party politicians,Kim Campbell
3457,Ted Kennedy,Robert Kennedy,Richard Nixon,Richard Nixon,The others are members of the Kennedy family,John F. Kennedy
3458,Nelson Mandela,Desmond Tutu,F. W. de Klerk,Desmond Tutu,The others were Presidents of South Africa,P. W. Botha
3459,Dmitry Medvedev,Boris Yeltsin,Mikhail Gorbachev,Mikhail Gorbachev,The others have served as President of Russia,Vladimir Putin
3460,Raul Castro,Hugo Chavez,Fidel Castro,Hugo Chavez,The others are Cuban leaders,Che Guevara
3461,Lee Kuan Yew,Lee Hsien Loong,Goh Chok Tong,Mahathir Mohamad,The others are Singaporean Prime Ministers,Mahathir Mohamad
3462,Snoop Dogg,Dr. Dre,Ice Cube,Jay Z,The others are associated with West Coast hip hop,Jay Z
3463,Dr. Dre,Nas,Jay Z,Dr. Dre,The others are associated with East Coast hip hop,Biggie Smalls
3464,Chris Cornell,Kurt Cobain,Layne Staley,Bono,The others are associated with the grunge movement,Bono
3465,Justin Timberlake,Christina Aguilera,Madonna,Madonna,The others are associated with the Mickey Mouse Club,Britney Spears
3466,Rafael Nadal,Roger Federer,Andy Murray,Andy Murray,The others have won more than 10 Grand Slam singles titles,Novak Djokovic
3467,Monica Seles,Martina Navratilova,Billie Jean King,Monica Seles,The others won their first Grand Slam singles title before the age of 20,Chris Evert
3468,Novak Djokovic,Andre Agassi,Pete Sampras,Andre Agassi,The others have held the world No. 1 spot for more than 200 weeks,Rafael Nadal
3469,Novak Djokovic,Rafael Nadal,Pete Sampras,Andre Agassi,The others have won more than 10 ATP Masters 1000 titles,Andre Agassi
3470,Serena Williams,Venus Williams,Maria Sharapova,Andy Murray,The others have won an Olympic gold medal in singles,Andy Murray
3471,Andre Agassi,Pete Sampras,Boris Becker,John McEnroe,The others have won Wimbledon and the US Open in the same year,John McEnroe
3472,Harvey Specter,Miles Edgeworth,Phoenix Wright,Harvey Specter,The others are from Ace Attorney,Maya Fey
3473,Alicia Florrick,Vinny Gambini,Diane Lockhart,Vinny Gambini,The others are from The Good Wife,Will Gardner
3474,Louis Litt,Paul Biegler,Harvey Specter,Paul Biegler,The others are from Suits,Mike Ross
3475,John Milton,Abbie Carmichael,Arthur Branch,John Milton,The others are from Law & Order,Jack McCoy
3476,Harvey Specter,Lily Aldrin,Marshall Eriksen,Harvey Specter,The others are from How I Met Your Mother,Ted Mosby
3477,Vinny Gambini,Abby McDeere,Wayne Tarrance,Vinny Gambini,The others are from The Firm,Mitch McDeere
3478,Phoenix Wright,Scout Finch,Jem Finch,Phoenix Wright,The others are from To Kill a Mockingbird,Atticus Finch
3479,Fire Station,Emergency Room,Ambulance Bay,Fire Station,The others are parts of a hospital,Intensive Care Unit
3480,Paramedic,EMT,Emergency Medical Dispatcher,Police Dispatcher,The others are in the EMS field,Police Dispatcher
3481,Police Car,Medical Helicopter,Rescue Boat,Police Car,The others are used for medical emergencies,Ambulance
3482,Physician,Paramedic,Nurse,Pharmacist,The others provide direct patient care,Pharmacist
3483,Otoscope,Microscope,Surgical Scissors,Microscope,The others are used directly on the patient,Stethoscope
3484,MRI Machine,Ultrasound Machine,EKG Machine,EKG Machine,The others are used for imaging,X-Ray Machine
3485,Thermometer,Suture,Splint,Thermometer,The others are used for wound treatment,Bandage
3486,Pet Carrier,Pet Crate,Pet Brush,Pet Brush,The others are pet containment items,Pet Bed
3487,Jean Piaget,Lawrence Kohlberg,John Bowlby,John Bowlby,The others proposed stages of development,Erik Erikson
3488,David Wechsler,Alfred Binet,Carl Jung,Carl Jung,The others developed intelligence tests,Francis Galton
3489,B.F. Skinner,Carl Rogers,Viktor Frankl,B.F. Skinner,The others are associated with humanistic psychology,Abraham Maslow
