id,obj_1,obj_2,obj_3,odd,reason_for_similarity,obj_4
3490,B.F. Skinner,John Watson,Carl Rogers,Carl Rogers,The others are associated with behaviorism,Albert Bandura
3491,Fridge,Mixer,Oven,Fridge,The others are commonly used in baking,Rolling pin
3492,Croissant,Baguette,Bratwurst,Bratwurst,The others are French baked goods,Pain au chocolat
3493,Chef's knife,Apron,Baker's hat,Chef's knife,The others are baker's attire,Oven mitts
3494,Eggs,Milk,Salt,Salt,The others are ingredients in cake,Flour
3495,Ciabatta,Brioche,Naan,Naan,The others are European breads,Challah
3496,Pizza,Focaccia,Calzone,Pasta,The others are baked Italian dishes,Pasta
3497,Danish,Cinnamon roll,Bagel,Bagel,The others are sweet pastries,Sticky bun
3498,Hakeem Olajuwon,Charles Barkley,Scottie Pippen,Charles Barkley,The others have won the MVP award,Karl Malone
3967,Banana,Strawberry,Avocado,Strawberry,The others are berries.,Melon
3499,Kareem Abdul-Jabbar,Magic Johnson,Bill Russell,Magic Johnson,The others have won more than 5 NBA championships,Shaquille O'Neal
3500,Dirk Nowitzki,Stephen Curry,Kevin Durant,Dirk Nowitzki,The others have won multiple NBA MVP awards,LeBron James
3501,Russell Westbrook,Chris Paul,Kevin Durant,Chris Paul,The others have won the NBA scoring title,James Harden
3502,Allen Iverson,Tim Duncan,Kevin Garnett,Allen Iverson,"The others are over 6'10""",Shaquille O'Neal
3503,Magic Johnson,LeBron James,Michael Jordan,Larry Bird,The others have won NBA Finals MVP more than once,Larry Bird
3504,Michael Jordan,LeBron James,Allen Iverson,Allen Iverson,The others have won more than 2 NBA championships,Kobe Bryant
3505,Justin Thomas,Dustin Johnson,Jordan Spieth,Jack Nicklaus,The others are winners of the PGA Tour Player of the Year in the 2010s,Jack Nicklaus
3506,Gary Player,Arnold Palmer,Tom Watson,Arnold Palmer,The others have won the Senior Open Championship,Jack Nicklaus
3507,Byron Nelson,Sam Snead,Tiger Woods,Tiger Woods,The others are golfers from the 1940s,Ben Hogan
3508,Lee Trevino,Gary Player,Jordan Spieth,Jordan Spieth,The others won the U.S. Open in the 1960s,Billy Casper
3509,Paul Azinger,Fred Couples,Davis Love III,Tommy Armour,The others are Presidents Cup captains,Tommy Armour
3510,Lee Westwood,Bobby Jones,Nick Faldo,Bobby Jones,The others are world number one golfers in the 1990s,Greg Norman
3511,Ben Crenshaw,Hale Irwin,Johnny Miller,Ben Crenshaw,The others won the U.S. Open in the 1970s,Tom Watson
3512,Walter Hagen,Henrik Stenson,Sergio Garcia,Walter Hagen,The others are European Tour Race to Dubai winners,Justin Rose
3513,Evgeni Malkin,Sidney Crosby,Phil Kessel,Marc-Andre Fleury,The others are Penguins forwards,Marc-Andre Fleury
3514,Zdeno Chara,Bobby Orr,Patrice Bergeron,Patrice Bergeron,The others are Bruins defensemen,Ray Bourque
3515,Alex Ovechkin,Nicklas Backstrom,T.J. Oshie,Braden Holtby,The others are Capitals forwards,Braden Holtby
3516,Mark Messier,Brian Leetch,Mike Richter,Mike Richter,The others are Rangers forwards,Adam Graves
3517,Connor McDavid,Darnell Nurse,Leon Draisaitl,Darnell Nurse,The others are Oilers forwards,Ryan Nugent-Hopkins
3518,Maurice Richard,Jean Beliveau,Patrick Roy,Patrick Roy,The others are Canadiens forwards,Guy Lafleur
3519,Peter Forsberg,Joe Sakic,Milan Hejduk,Patrick Roy,The others are Avalanche forwards,Patrick Roy
3520,Chris Osgood,Sergei Fedorov,Nicklas Lidstrom,Chris Osgood,The others are Red Wings skaters,Steve Yzerman
3521,Brett Hull,Adam Oates,Curtis Joseph,Curtis Joseph,The others are Blues forwards,Al MacInnis
3522,Paul Kariya,Jean-Sebastien Giguere,Ryan Getzlaf,Jean-Sebastien Giguere,The others are Ducks forwards,Teemu Selanne
3523,Mike Bossy,Billy Smith,Denis Potvin,Billy Smith,The others are Islanders skaters,Bryan Trottier
3524,Jonathan Toews,Corey Crawford,Patrick Kane,Corey Crawford,The others are Blackhawks skaters,Duncan Keith
3525,Gerry Cheevers,Phil Esposito,Ray Bourque,Gerry Cheevers,The others are Bruins skaters,Bobby Orr
3526,Lanny McDonald,Jarome Iginla,Miikka Kiprusoff,Miikka Kiprusoff,The others are Flames forwards,Theo Fleury
3527,Martin Brodeur,Scott Stevens,Scott Niedermayer,Martin Brodeur,The others are Devils skaters,Patrik Elias
3528,Marcel Dionne,Dave Taylor,Rogie Vachon,Rogie Vachon,The others are Kings forwards,Luc Robitaille
3529,Ron Hextall,Eric Lindros,Mikael Renberg,Ron Hextall,The others are Flyers forwards,John LeClair
3530,Patrick Roy,Joe Sakic,Peter Stastny,Patrick Roy,The others are Nordiques/Avalanche forwards,Milan Hejduk
3531,Markus Naslund,Trevor Linden,Kirk Mclean,Kirk Mclean,The others are Canucks forwards,Pavel Bure
3532,Ryu,Sonic,Guile,Sonic,The others are characters from Street Fighter,Ken
3533,John Coltrane,Neil Young,Bob Dylan,John Coltrane,The others are folk rock musicians,Bruce Springsteen
3534,Phil Lesh,Bob Weir,Neil Young,Neil Young,The others are members of Grateful Dead,Jerry Garcia
3535,Liam Gallagher,Alex James,Graham Coxon,Liam Gallagher,The others are members of Blur,Damon Albarn
3536,Michael Stipe,Mike Mills,Bono,Bono,The others are members of R.E.M.,Peter Buck
3537,Mick Jagger,John Entwistle,Roger Daltrey,Mick Jagger,The others are members of The Who,Pete Townshend
3538,Lol Tolhurst,Morrissey,Robert Smith,Morrissey,The others are members of The Cure,Simon Gallup
3539,Diego Rivera,Claude Monet,Frida Kahlo,Claude Monet,The others are Mexican Muralists.,David Alfaro Siqueiros
3540,Vincent van Gogh,Frans Hals,Johannes Vermeer,Vincent van Gogh,The others are Dutch Golden Age artists.,Rembrandt
3541,Piet Mondrian,Kazimir Malevich,Wassily Kandinsky,Leonardo da Vinci,The others are Abstract artists.,Leonardo da Vinci
3542,Vincent van Gogh,Salvador Dali,Paul Gauguin,Salvador Dali,The others are Post-Impressionists.,Édouard Manet
3543,Kitagawa Utamaro,Katsushika Hokusai,Van Gogh,Van Gogh,The others are Ukiyo-e artists.,Utagawa Hiroshige
3544,Frida Kahlo,Paul Signac,Georges Seurat,Frida Kahlo,The others are Neo-Impressionists.,Camille Pissarro
3545,Leonardo da Vinci,Kazimir Malevich,Marc Chagall,Leonardo da Vinci,The others are Russian Avant-garde artists.,Wassily Kandinsky
3546,Jackson Pollock,Pablo Picasso,Mark Rothko,Pablo Picasso,The others are Abstract Expressionists.,Willem de Kooning
3547,Claude Monet,Edward Hopper,Thomas Hart Benton,Claude Monet,The others are American Regionalists.,Grant Wood
3548,René Magritte,Vincent van Gogh,Frida Kahlo,Vincent van Gogh,The others are Surrealists.,Salvador Dali
3549,Kenny Scharf,Claude Monet,Keith Haring,Claude Monet,The others are Pop artists.,Jean-Michel Basquiat
3550,Hieronymus Bosch,Jan van Eyck,Vincent van Gogh,Vincent van Gogh,The others are Early Netherlandish painters.,Rogier van der Weyden
3551,Titian,Veronese,Tintoretto,Claude Monet,The others are Venetian Renaissance artists.,Claude Monet
3552,Nietzsche,Marx,Kant,Kant,The others are critics of religion,Freud
3553,Mill,Bentham,Kant,Kant,The others are Utilitarians,Sidgwick
3554,Socrates,Euclid,Archimedes,Socrates,The others are ancient Greek mathematicians,Pythagoras
3555,Foucault,Derrida,Deleuze,Heidegger,The others are Post-structuralists,Heidegger
3556,Claude Debussy,George Frideric Handel,Johann Sebastian Bach,Claude Debussy,The others are from the Baroque period,Antonio Vivaldi
3557,Maurice Ravel,Johann Strauss II,Claude Debussy,Johann Strauss II,The others are from France,Erik Satie
3558,Sergei Rachmaninoff,Johannes Brahms,Robert Schumann,Sergei Rachmaninoff,The others are from Germany,Richard Wagner
3559,Franz Schubert,Frédéric Chopin,Wolfgang Amadeus Mozart,Frédéric Chopin,The others composed symphonies,Ludwig van Beethoven
3560,Johann Sebastian Bach,Franz Liszt,George Frideric Handel,Franz Liszt,The others composed oratorios,Antonio Vivaldi
3561,Johann Strauss II,Claude Debussy,Maurice Ravel,Johann Strauss II,The others composed ballets,Erik Satie
3562,Johann Strauss II,Sergei Prokofiev,Franz Schubert,Sergei Prokofiev,The others composed polkas,Ludwig van Beethoven
3563,Frédéric Chopin,Franz Liszt,Johann Sebastian Bach,Johann Sebastian Bach,The others composed ballades,Robert Schumann
3564,Claude Debussy,Antonio Vivaldi,George Frideric Handel,Claude Debussy,The others composed cantatas,Johann Sebastian Bach
3565,Sergei Rachmaninoff,Johannes Brahms,Robert Schumann,Sergei Rachmaninoff,The others composed requiems,Richard Wagner
3566,Johann Sebastian Bach,Frédéric Chopin,Robert Schumann,Johann Sebastian Bach,The others composed nocturnes,Franz Liszt
3567,Omar Khayyam,Hafez,Saadi,Omar Khayyam,The others are Persian poets from the 13th century,Rumi
3568,Emily Dickinson,Walt Whitman,Lewis Carroll,Lewis Carroll,The others are poets who never married,Robert Frost
3569,Jibanananda Das,Pablo Neruda,Rabindranath Tagore,Pablo Neruda,The others are Bengali poets,Kazi Nazrul Islam
3570,William Wordsworth,John Keats,Percy Bysshe Shelley,William Wordsworth,The others died young,Lord Byron
3571,Alexander Pope,John Dryden,Samuel Johnson,William Blake,The others are Augustan poets,William Blake
3572,Geoffrey Chaucer,William Langland,John Gower,Thomas Malory,The others are Middle English poets,Thomas Malory
3573,Henrik Wergeland,Henrik Ibsen,Edvard Munch,Edvard Munch,The others are Norwegian poets,August Strindberg
3575,Boccaccio,Petrarch,Machiavelli,Machiavelli,The others are Italian poets of the 14th century,Dante Alighieri
3576,Alexander Pushkin,Mikhail Lermontov,Fyodor Tyutchev,Leo Tolstoy,The others are Russian Romantic poets,Leo Tolstoy
3577,Arthur Rimbaud,Charles Baudelaire,Paul Verlaine,Victor Hugo,The others are French Symbolist poets,Victor Hugo
3578,John Keats,Lord Byron,William Wordsworth,William Wordsworth,The others are poets who lived in Italy,Percy Bysshe Shelley
3579,Rabindranath Tagore,R.K. Narayan,Kazi Nazrul Islam,R.K. Narayan,The others are poets who wrote in Bengali,Jibanananda Das
3580,Charles Dickens,Samuel Taylor Coleridge,William Wordsworth,Charles Dickens,The others are poets who were not novelists,William Blake
3581,Robert Browning,Charles Darwin,Elizabeth Barrett Browning,Charles Darwin,The others are poets who lived in the Victorian era,Christina Rossetti
3582,X-Ray Machine,Stethoscope,Ultrasound Machine,Scalpel,The others are used for diagnostic purposes,Scalpel
3583,Rabies,Lyme Disease,Heartworm,Diabetes,The others are transmitted by parasites,Diabetes
3584,Feline Leukemia Virus,Rabies Virus,Canine Parvovirus,Influenza Virus,The others are common in pets,Influenza Virus
3585,Sigmund Freud,Carl Jung,Anna Freud,Erik Erikson,The others are directly associated with psychoanalysis,Erik Erikson
3586,Carl Rogers,Philip Zimbardo,Stanley Milgram,Carl Rogers,The others conducted famous social psychology experiments,Solomon Asch
3587,Carl Rogers,Solomon Asch,Stanley Milgram,Carl Rogers,The others are known for their work in social psychology,Philip Zimbardo
3588,Jean Piaget,Erik Erikson,Lev Vygotsky,Carl Jung,The others are associated with developmental psychology,Carl Jung
3589,Alfred Adler,Sigmund Freud,Wilhelm Wundt,Wilhelm Wundt,The others are associated with the psychoanalytic school of thought,Carl Jung
3590,Albert Bandura,Sigmund Freud,Carl Rogers,Sigmund Freud,The others are Behaviorists,B.F. Skinner
3591,Francine Shapiro,John Gottman,Marsha Linehan,Carl Rogers,The others are founders of Therapies,Carl Rogers
3592,Virginia Satir,Carl Rogers,B.F. Skinner,B.F. Skinner,The others are Humanistic therapists,Fritz Perls
3593,Sigmund Freud,Aaron Beck,Donald Meichenbaum,Sigmund Freud,The others are Cognitive therapists,Albert Ellis
3594,Ardbeg,Glenmorangie,Lagavulin,Glenmorangie,The others are Islay Scotch whisky distilleries,Laphroaig
3595,Macallan,Laphroaig,Glenlivet,Laphroaig,The others are Speyside Scotch whisky distilleries,Glenfiddich
3596,Jameson,Glenkinchie,Tullamore D.E.W.,Glenkinchie,The others are Irish whiskey distilleries,Bushmills
3597,Jim Beam,Don Julio,Jose Cuervo,Jim Beam,The others are Tequila distilleries,Patron
3598,Wolfburn,Scapa,Highland Park,Glenlivet,The others are Island Scotch whisky distilleries,Glenlivet
3599,Auchentoshan,Bladnoch,Glenfiddich,Glenfiddich,The others are Lowland Scotch whisky distilleries,Glenkinchie
3600,Dalmore,Glenkinchie,Glenmorangie,Glenkinchie,The others are Highland Scotch whisky distilleries,Old Pulteney
3601,J&B,Glenkinchie,Johnnie Walker,Glenkinchie,The others are blended Scotch whisky brands,Buchanan's
3602,Yellow,Cyan,Magenta,Green,The others are subtractive primary colors,Green
3603,Purple,Brown,Orange,Brown,The others are secondary colors,Green
3604,Black,Gray,Red,Red,The others are shades of gray,White
3605,Violet,Indigo,Blue,Orange,The others are cool colors,Orange
3606,Yellow,Orange,Red,Green,The others are warm colors,Green
3607,Gold,Silver,Platinum,Platinum,The others are Olympic medal colors,Bronze
3608,Pink,Lime,Fuchsia,Lime,The others are shades of pink,Rose
3609,Sky Blue,Navy,Royal Blue,Forest Green,The others are shades of blue,Forest Green
3610,Crimson,Emerald,Maroon,Emerald,The others are shades of red,Scarlet
3611,Lavender,Forest Green,Olive Green,Lavender,The others are shades of green,Lime Green
3612,Gold,Yellow,Lemon,Ruby,The others are shades of yellow,Ruby
3613,Violet,Lavender,Lilac,Peach,The others are shades of purple,Peach
3615,Charcoal,Ivory,Beige,Charcoal,The others are shades of white,Cream
3616,White,Green,Gray,Green,The others are grayscale colors,Black
3614,Tan (color),Beige,Brown,Burgundy,The others are shades of brown,Burgundy (color)
3617,Sapphire,Tangerine,Peach,Sapphire,The others are shades of orange,Apricot
3618,Bronze,Brass,Copper,Pearl,The others are metallic colors,Pearl
3619,Gray,Purple,Black,Purple,The others are shades of black and white,White
3620,Blue,Pink,Indigo,Pink,The others are colors of the rainbow,Violet
3621,Turquoise,Maroon,Teal,Maroon,The others are shades of blue-green,Aqua
3622,Lemon,Peach,Coral,Lemon,The others are shades of red-orange,Salmon
3624,Daisy,Violet,Lavender,Daisy,The others are named after purple flowers,Lilac
3625,Strawberry,Banana,Raspberry,Banana,The others are named after red fruits,Cherry
3626,Cinnamon,Jade,Fern,Cinnamon,The others are named after green plants,Mint
3627,Caramel,Amber,Chocolate,Chocolate,The others are named after yellow-brown substances,Honey
3628,Brass,Bronze,Copper,Platinum,The others are named after brown metals,Platinum
3629,Teal,Maroon,Wine,Teal,The others are shades of dark red,Cardinal
3631,Grape,Currant,Lemon,Lemon,The others are named after purple fruits,Plum
3632,Cinnamon,Mint,Jade,Cinnamon,The others are named after green gemstones,Emerald
3633,Pink,Grey,White,Pink,The others are neutral colors,Black
3634,Onyx,Charcoal,Ebony,Pearl,The others are shades of black,Pearl
3635,Coco Chanel,Karl Lagerfeld,Marc Jacobs,Ralph Lauren,The others are European designers.,Ralph Lauren
3636,Brutalism,Art Deco,Cubism,Cubism,The others are architectural styles.,Bauhaus
3637,Chanel,Nike,Gucci,Nike,The others are high-end luxury fashion brands.,Louis Vuitton
3638,Adidas,Prada,Gucci,Adidas,The others are Italian fashion brands.,Versace
3639,Postmodernism,Art Nouveau,Brutalism,Art Nouveau,The others are 20th century architectural styles,Modernism
3640,De Stijl,Cubism,Art Deco,Cubism,The others are design movements,Bauhaus
3641,Futura,Garamond,Papyrus,Papyrus,The others are fonts named after places,Georgia
3642,Walter Gropius,Charles Eames,Mies van der Rohe,Charles Eames,The others are associated with the Bauhaus,Le Corbusier
3643,Frank Lloyd Wright,Saul Bass,Milton Glaser,Frank Lloyd Wright,The others are graphic designers,Paul Rand
3644,Dolce & Gabbana,Versace,Jeff Bezos,Jeff Bezos,The others are Italian fashion designers,Giorgio Armani
3645,Florence Knoll,Donatella Versace,Eero Saarinen,Donatella Versace,The others are furniture designers,Charles Eames
3646,Philippe Starck,Karim Rashid,Marcel Wanders,Calvin Klein,The others are product designers,Calvin Klein
3647,Gianni Versace,Christian Dior,Louis Vuitton,Gianni Versace,The others are French designers,Coco Chanel
3648,Prada,Burberry,Versace,Burberry,The others are Italian designers,Gucci
3649,Vera Wang,Jean Paul Gaultier,Jason Wu,Jean Paul Gaultier,The others are American designers of Chinese descent,Anna Sui
3650,Paul Smith,Alexander McQueen,Versace,Versace,The others are British designers,Burberry
3651,Hugo Boss,Ralph Lauren,Karl Lagerfeld,Ralph Lauren,The others are German designers,Jil Sander
3652,Versace,Gucci,Chanel,Chanel,The others are Italian brands,Prada
3653,Calvin Klein,Louis Vuitton,Christian Dior,Calvin Klein,The others are French brands,Givenchy
3654,St. Peter's Basilica,Notre-Dame Cathedral,The White House,The White House,The others are religious buildings,Westminster Abbey
3655,The Pantheon,The Parthenon,The Temple of Artemis,The Statue of Liberty,The others are ancient temples,The Statue of Liberty
3656,The Gherkin,The Shard,The Louvre Pyramid,The Louvre Pyramid,The others are skyscrapers,The Burj Khalifa
3657,The Empire State Building,The Flatiron Building,The Leaning Tower of Pisa,The Leaning Tower of Pisa,The others are in New York,The Chrysler Building
3658,The Guggenheim Bilbao,The Sydney Opera House,The Taj Mahal,The Taj Mahal,The others are modern architecture,The Walt Disney Concert Hall
3659,The Acropolis,The Roman Forum,Machu Picchu,The Eiffel Tower,The others are ruins,The Eiffel Tower
3660,The Colosseum,The Great Wall of China,The Pantheon,The Great Wall of China,The others are in Rome,The Forum
3661,The Burj Khalifa,One World Trade Center,The Petronas Towers,The Leaning Tower of Pisa,The others are tallest buildings,The Leaning Tower of Pisa
3662,The Walkie Talkie,The Gherkin,The Shard,The White House,The others are in London,The White House
3663,The Burj Al Arab,The Taipei 101,The Colosseum,The Colosseum,The others are modern skyscrapers,The Petronas Towers
3664,The Eiffel Tower,The Parthenon,The Erechtheion,The Eiffel Tower,The others are in Athens,The Temple of Hephaestus
3665,The Buckingham Palace,The White House,The Windsor Castle,The White House,The others are in England,The Tower of London
3666,The Eiffel Tower,Topkapi Palace,The Hagia Sophia,The Eiffel Tower,The others are in Istanbul,The Blue Mosque
3667,The Willis Tower,The CN Tower,The Empire State Building,The Colosseum,The others are towers,The Colosseum
3668,Gothic Architecture,Renaissance Architecture,Baroque Architecture,Brutalist Architecture,The others are pre-20th century architectural styles,Brutalist Architecture
3669,The White House,The Empire State Building,The Capitol Building,The Empire State Building,The others are in Washington D.C,The Washington Monument
3670,The Parthenon,The Louvre,The Pantheon,The Louvre,The others are ancient Roman structures,The Colosseum
3671,The Flatiron Building,The Golden Gate Bridge,The Chrysler Building,The Golden Gate Bridge,The others are in New York City,The Empire State Building
3672,The Louvre Pyramid,The Luxor Hotel,The Pyramids of Giza,The Pyramids of Giza,The others are modern glass structures,The Glass Pyramid of The Moody Gardens
3673,Casa Mila,Park Guell,The White House,The White House,The others are designed by Antoni Gaudi,The Sagrada Familia
3674,The Leaning Tower of Pisa,The Eiffel Tower,The Great Wall of China,The Great Wall of China,The others are freestanding structures,The Statue of Liberty
3675,The Guggenheim Museum Venice,The Guggenheim Museum Bilbao,The Guggenheim Museum New York,The Louvre,The others are Guggenheim museums,The Louvre
3676,The Western Wall,The Great Wall of China,The CN Tower,The CN Tower,The others are walls,The Berlin Wall
3677,The Flatiron Building,The Empire State Building,The Golden Gate Bridge,The Golden Gate Bridge,The others are famous New York buildings,The Chrysler Building
3678,The Louvre,The Harbour Bridge,The Sydney Opera House,The Louvre,The others are located in Sydney,The Queen Victoria Building
3679,The Topkapi Palace,The Blue Mosque,The Buckingham Palace,The Buckingham Palace,The others are located in Istanbul,The Hagia Sophia
3680,The Palm Jumeirah,The Burj Khalifa,The Burj Al Arab,The Eiffel Tower,The others are located in Dubai,The Eiffel Tower
3681,The Forbidden City,The Great Wall of China,The Summer Palace,The Sydney Opera House,The others are located in Beijing,The Sydney Opera House
3682,The Taj Mahal,The Lotus Temple,The Qutb Minar,The White House,The others are located in India,The White House
3683,Golden Gate Bridge,Alcatraz Island,The Shard,The Shard,The others are in San Francisco,Fisherman's Wharf
3684,Rosemary,Paprika,Saffron,Rosemary,The others are used in curry,Turmeric
3685,Fennel,Coriander,Cumin,Coriander,The others are licorice-flavored spices,Anise
3686,Cayenne,Thyme,Bay leaves,Cayenne,The others are used in French cuisine,Tarragon
3687,Cumin,Cinnamon,Turmeric,Cinnamon,The others are used in Turmeric Latte,Coriander
3688,Nutmeg,Black Pepper,Cayenne Pepper,Nutmeg,The others are hot spices,Chili Powder
3689,Parsley,Dill,Rosemary,Paprika,The others are used in Ranch seasoning,Paprika
3690,Cinnamon,Parsley,Cilantro,Cinnamon,The others are leafy herbs,Dill
3691,Cinnamon,Vanilla,Paprika,Paprika,The others are used in desserts,Saffron
3692,Cayenne Pepper,Garlic Powder,Ginger Powder,Cayenne Pepper,The others are powdered form of root spices,Onion Powder
3693,Rosemary,Thyme,Cardamom,Cardamom,The others are used in Poultry Seasoning,Sage
3694,Ginger,Saffron,Paprika,Ginger,The others are red spices,Turmeric
3695,Parsley,Black Pepper,Basil,Black Pepper,The others are used in Italian Seasoning,Oregano
3696,Cumin,Vanilla,Fenugreek,Vanilla,The others are used in Ethiopian Berbere Spice,Coriander
3697,Cardamom,Nutmeg,Basil,Basil,The others are used in Gingersnap Cookies,Cinnamon
3698,Allspice,Clove,Cinnamon,Turmeric,The others are used in Jamaican Jerk Seasoning,Turmeric
3699,Basil,Turmeric,Saffron,Basil,The others are used in Indian cuisine,Cumin
3700,Thyme,Star Anise,Anise,Thyme,The others have a licorice flavor,Fennel
3701,Cilantro,Paprika,Cayenne,Cilantro,The others are types of peppers,Chili Powder
3702,Cumin,Coriander,Turmeric,Cinnamon,The others are used in curry powder,Cinnamon
3703,Sage,Mace,Nutmeg,Sage,The others come from the Myristica genus,Clove
3704,Clove,Bay Leaf,Cinnamon,Bay Leaf,The others are used in pumpkin spice,Allspice
3705,Galangal,Turmeric,Saffron,Saffron,The others are rhizomes,Ginger
3706,Onion Powder,Garlic Powder,Ginger Powder,Curry Powder,The others are single-ingredient powders,Curry Powder
3707,Oregano,Rosemary,Basil,Saffron,The others are Italian herbs,Saffron
3708,Ginger,Clove,Cinnamon,Ginger,The others are tree spices,Nutmeg
3709,Red Pepper Flakes,Black Pepper,Chili Powder,Black Pepper,The others are made from capsicum peppers,Cayenne Pepper
3710,Parsley,Basil,Dill,Rosemary,The others are soft herbs,Rosemary
3711,Cinnamon,Mace,Allspice,Allspice,The others are from the Myristica genus,Nutmeg
3712,Turmeric,Cumin,Curry Powder,Cumin,The others are spice blends,Garam Masala
3713,Onion,Ginger,Garlic,Turmeric,The others are allium spices,Turmeric
3714,Cumin,Fennel,Star Anise,Cumin,The others are anise-flavored spices,Anise
3715,Basil,Dill,Parsley,Basil,The others are used in salsa,Cilantro
3716,Cardamom,Cumin,Coriander,Cardamom,The others are used in pickling spices,Fennel
3717,Allspice,Cinnamon,Saffron,Saffron,The others are used in mulled wine,Clove
3718,Cumin,Coriander,Cardamom,Cardamom,The others are used in harissa,Caraway
3719,Onion,Ginger,Garlic,Saffron,The others are used in stir-fry,Saffron
3720,Rosemary,Thyme,Cumin,Cumin,The others are used in herbes de Provence,Oregano
3721,Fennel,Star Anise,Anise,Cumin,The others are used in Chinese five-spice,Cumin
3722,Black Pepper,Rosemary,Cinnamon,Cinnamon,The others are savory spices,Cumin
3723,Cumin,Star Anise,Cloves,Saffron,The others are used in Chinese cooking,Saffron
3724,Nutmeg,Cinnamon,Cloves,Oregano,The others are used in sweet dishes,Oregano
3725,Coriander,Turmeric,Cumin,Thyme,The others are used in Indian cooking,Thyme
3726,Saffron,Basil,Oregano,Saffron,The others are used in Italian cooking,Thyme
3727,Rosemary,Cardamom,Thyme,Cardamom,The others are used in Western cooking,Parsley
3728,Saffron,Turmeric,Paprika,Mint,The others are used in paella,Mint
3729,Mustard,Cinnamon,Ginger,Cinnamon,The others are used in pickling,Turmeric
3730,Nutmeg,Basil,Ginger,Basil,The others are used in gingerbread,Cinnamon
3731,Cumin,Coriander,Oregano,Oregano,The others are used in Middle Eastern cooking,Fenugreek
3732,Cinnamon,Nutmeg,Allspice,Saffron,The others are used in pumpkin pie,Saffron
3733,Nutmeg,Mace,Cinnamon,Paprika,The others are used in apple pie,Paprika
3734,Paprika,Mint,Cayenne Pepper,Mint,The others are used in chili,Chili Powder
3735,Thyme,Bay Leaf,Rosemary,Ginger,The others are used in roasts,Ginger
3736,Cumin,Turmeric,Coriander,Cinnamon,The others are used in Tandoori Masala,Cinnamon
3737,Star Anise,Cinnamon,Cloves,Dill,The others are used in Pho,Dill
3738,Rosemary,Thyme,Bay Leaf,Cinnamon,The others are used in Bouquet Garni,Cinnamon
3739,Cumin,Coriander,Cardamom,Thyme,The others are used in Chai tea,Thyme
3740,Saffron,Chili Powder,Paprika,Saffron,The others are used in hot sauce,Cayenne Pepper
3741,Cinnamon,Basil,Turmeric,Basil,The others are ground spices,Paprika
3742,Cinnamon,Nutmeg,Ginger,Ginger,The others are used in pumpkin pie spice,Allspice
3743,Cinnamon,Ginger,Cardamom,Parsley,The others are used in chai tea,Parsley
3744,Cumin,Cayenne,Paprika,Turmeric,The others are red,Turmeric
3745,Saffron,Chili,Cayenne,Saffron,The others are spicy,Paprika
3746,Cumin,Saffron,Cayenne,Cayenne,The others are yellow,Turmeric
3747,Rosemary,Thyme,Basil,Paprika,The others are used in poultry seasoning,Paprika
3748,Coriander,Paprika,Cardamom,Paprika,The others are used in Biryani,Cumin
3749,Cayenne,Cinnamon,Nutmeg,Cayenne,The others are used in eggnog,Clove
3750,Cayenne,Saffron,Turmeric,Cayenne,The others are used in Ayurveda,Ginger
3751,Nutmeg,Coriander,Clove,Coriander,The others are used in Christmas cookies,Cinnamon
3752,Turmeric,Salt,Cumin,Salt,The others are ground from seeds,Paprika
