"obj_1","obj_2","obj_3","obj_4","odd","reason_for_similarity"
"Antony and Cleopatra","Romeo and Juliet","The Taming of the Shrew","A Midsummer Night's Dream","The Taming of the Shrew","The others are Tragedies"
"Blacktip Shark","Blue Shark","Leopard Shark","Nurse Shark","Nurse Shark","The others are requiem sharks"
"The Farewell Address","Give me Liberty or Give me Death","The Light of the World","The Declaration of Independence","The Light of the World","The others are American historical documents."
"Richard III","Henry VI","All's Well That Ends Well","Macbeth","Macbeth","The others are written during the reign of Queen Elizabeth I."
"Peregrine Falcon","Gyrfalcon","Harpy Eagle","Emperor Penguin","Emperor Penguin","The others are birds of prey"
"Chuckwalla","Desert Iguana","Gila Monster","Komodo Dragon","Komodo Dragon","The others are native to North America."
"Cooper's Hawk","White-tailed Hawk","Rough-legged Hawk","American Kestrel","American Kestrel","The others are hawks"
"Hydra","Serpens","Ursa Minor","Orion","Orion","The others are water-related"
"The Hostel","Saw","The Ring","The Shining","The Shining","The others are part of a series."
"The Dark Tower","The Stand","Star Trek","1984","1984","The others are written by Stephen King."
"Lion Whisperer","Lion Keeper","Lion King Tickets","Lion Sculpture","Lion King Tickets","The others are occupations."
"Sumatran Tiger","Siberian Tiger","Cheetah","Bengal Cat","Bengal Cat","The others are big cats in the Panthera genus."
"Kobe Bryant","Michael Jordan","Tiger Woods","Derek Jeter","Tiger Woods","The others are NBA players."
"obj_3: Vintage Stamp",,,,,
"obj_4: Classic Book",,,,,
"odd: Classic Book",,,,,
"reason_for_similarity: The others are used for communication.",,,,,
"1964 Chevrolet Impala, 1964 Ford Galaxie, 1964 Ferrari 250 GTO, 1964 Vespa Scooter, 1964 Vespa Scooter, The others are cars.",,,,,
"Glass Frog","Ghost Frog","Barking Tree Frog","Glass Vase","Glass Vase","The others are species of frogs."
"The Farewell Address","The Gettysburg Address","Give me Liberty or Give me Death","The I Have a Dream Speech","Give me Liberty or Give me Death","The others are speeches by U.S. Presidents."
"Collectible Pin","Vintage Brooch","Antique Earring","Ancient Coin","Ancient Coin","The others are types of jewelry"
"Epicurus","Lucretius","Pyrrho","Aristotle","Aristotle","The others are founders of Hellenistic philosophies"
"It's Always Sunny in Philadelphia","The League","The West Wing","Modern Family","The West Wing","The others are sitcoms."
"The Hunger Games","Divergent","The Matrix","The Notebook","The Matrix","The others are based on novels written by female authors"
"Saturn","Uranus","Venus","Neptune","Venus","The others are gas giants"
"Western Pond Turtle","Eastern Painted Turtle","Leatherback Sea Turtle","Green Iguana","Green Iguana","The others are Turtles."
"Ricky Gervais","Russell Peters","Aziz Ansari","Stephen Fry","Stephen Fry","The others are stand-up comedians."
"Fiji Banded Iguana, Lesser Antillean Iguana, Agama Lizard, Komodo Dragon, Agama Lizard, The others are endemic to islands.",,,,,
"The Firm","The Client","The Girl on the Train","The Da Vinci Code","The Girl on the Train","The others are written by John Grisham"
"Mars","Venus","Pluto","Moon","Moon","The others are planets"
"Taipan","Mamba","Anaconda","Python","Python","The others are venomous"
"The Evil Dead","Night of the Living Dead","The Silence of the Lambs","Psycho","Psycho","The others are movies with undead themes."
"Dolphin Marine","Dolphin Saltwater","Dolphin Freshwater","Dolphin Aerial","Dolphin Aerial","The others are types of dolphins associated with water environments"
"1969 Dodge Charger","1969 Ford Mustang","1969 Chevrolet Camaro","1969 Volkswagen Beetle","1969 Volkswagen Beetle","The others are American muscle cars"
"Atlantic Angel Shark","Scalloped Hammerhead","Sand Tiger Shark","Great White Shark","Atlantic Angel Shark","The others are aggressive towards humans"
"Tiger Claw","Tiger Lily","Bengal Tiger","Tiger's Eye","Tiger's Eye","The others are biological entities."
"Kenai Peninsula Wolf","Manitoba Wolf","Raccoon Dog","Red Fox","Red Fox","The others are Canids that are not part of the Vulpes genus."
"Aprilia RSV4, Kawasaki ZX-14R, Honda Rebel 500, Ducati Panigale V4, Honda Rebel 500, The others are sport motorcycles.",,,,,
"Plotinus","Proclus","Socrates","Aristotle","Aristotle","The others are Neoplatonists"
"Dolphin Live Birth, Dolphin Nursing, Dolphin Egg-laying, Dolphin Fasting, Dolphin Egg-laying, The others are related to dolphin's feeding habits.",,,,,
"Finding Nemo","Finding Dory","Toy Story","Jurassic Park","Jurassic Park","The others are Pixar movies"
"Humpback Whale","Gray Whale","Orca","Dolphin","Dolphin","The others are whales"
"The Simpsons","Family Guy","Stranger Things","Friends","Stranger Things","The others are animated series."
"Nibelungenlied","Beowulf","Mahabharata","The Iliad","The Iliad","The others are not Greek epics."
"Henry VI","Richard II","Macbeth","The Tempest","The Tempest","The others are historical plays by Shakespeare."
"IT (1990)","IT (2017)","The Exorcist","Jaws","Jaws","The others are based on novels by Stephen King."
"Male Lion","Female Lion","Lion's Mane Jellyfish","Sea Lion","Lion's Mane Jellyfish","The others are actual Lions"
"Dave Chappelle","Eddie Murphy","Bill Burr","Jim Carrey","Jim Carrey","The others are American stand-up comedians."
"Golden Eagle","Bald Eagle","Philippine Eagle","Peregrine Falcon","Peregrine Falcon","The others are Eagles."
"1965 Aston Martin DB5","1965 Shelby Cobra 427 S/C","1965 Chevrolet Corvette","1965 Ford Mustang","1965 Aston Martin DB5","The others are American made cars."
"The Iron Curtain","The Man with the Muckrake","Give me Liberty or Give me Death","The Starry Night","The Starry Night","The others are related to political speeches or concepts."
"Vinyl Record","CD Album","MP3 file","Cassette Tape","MP3 file","The others are physical media"
"Corn Snake, Garter Snake, Cottonmouth, Komodo Dragon, Komodo Dragon, The others are Non-Venomous snakes.",,,,,
"Rattlesnake","Copperhead","Green Anaconda","Komodo Dragon","Komodo Dragon","The others are venomous snakes."
"Neptune","Uranus","Mars","Sun","Mars","The others are gas giants"